{
  "$schema": "https://json-schema.org/draft/2020-12/schema",
  "$id": "ui.schema.json",
  "title": "Grensesnittstrenger",
  "description": "Det ENESTE stedet norske strenger finnes utenfor src/innhold/. Nye noekler krever godkjenning fra Erlend Bognoey. Vakten ui-kryssjekk.js krysssjekker at alle noekler brukes og at alle ui.*-oppslag finnes her.",
  "type": "object",
  "additionalProperties": false,
  "required": [
    "hopp_til_innhold",
    "brodsmulesti",
    "hovednavigasjon",
    "bunntekst",
    "utkast_banner",
    "les_mer",
    "bestill_time",
    "ring_oss",
    "kontakt",
    "fagansvar",
    "medisinsk_fagansvarlig",
    "yrkestittel",
    "tillatelse",
    "tilsynsmyndighet",
    "org_nr_etikett",
    "hpr_etikett",
    "bestilling_apner",
    "apner_nytt_vindu",
    "venter_pa_klinikken",
    "venter_priser"
  ],
  "properties": {
    "hopp_til_innhold": {
      "type": "string",
      "minLength": 1
    },
    "brodsmulesti": {
      "type": "string",
      "minLength": 1
    },
    "hovednavigasjon": {
      "type": "string",
      "minLength": 1
    },
    "bunntekst": {
      "type": "string",
      "minLength": 1
    },
    "utkast_banner": {
      "type": "string",
      "minLength": 1
    },
    "les_mer": {
      "type": "string",
      "minLength": 2
    },
    "bestill_time": {
      "type": "string",
      "minLength": 2
    },
    "ring_oss": {
      "type": "string",
      "minLength": 2
    },
    "kontakt": {
      "type": "string",
      "minLength": 2
    },
    "fagansvar": {
      "type": "string",
      "minLength": 2
    },
    "medisinsk_fagansvarlig": {
      "type": "string",
      "minLength": 2
    },
    "yrkestittel": {
      "type": "string",
      "minLength": 2
    },
    "tillatelse": {
      "type": "string",
      "minLength": 2
    },
    "tilsynsmyndighet": {
      "type": "string",
      "minLength": 2
    },
    "org_nr_etikett": {
      "type": "string",
      "minLength": 2
    },
    "hpr_etikett": {
      "type": "string",
      "minLength": 2
    },
    "bestilling_apner": {
      "type": "string",
      "minLength": 2
    },
    "apner_nytt_vindu": {
      "type": "string",
      "minLength": 2
    },
    "venter_pa_klinikken": {
      "type": "string",
      "minLength": 2,
      "description": "Markoer i forhaandsvisningen for et element som er utelatt fordi et felt i klinikk.json mangler. Vises aldri i produksjon (arbeidsordre 24.09.2026)."
    },
    "venter_priser": {
      "type": "string",
      "minLength": 2,
      "description": "Feltnavnet i markoeren naar ingen prisrad har beloep. Vises aldri i produksjon."
    }
  }
}
