{
  "hopp_til_innhold": "Hopp til innhold",
  "brodsmulesti": "Brødsmulesti",
  "hovednavigasjon": "Hovednavigasjon",
  "bunntekst": "Bunntekst",
  "utkast_banner": "UTKAST — ikke godkjent innhold",
  "les_mer": "Les mer ›",
  "bestill_time": "Bestill time",
  "ring_oss": "Ring oss",
  "kontakt": "Kontakt",
  "fagansvar": "Fagansvar og tilsyn",
  "medisinsk_fagansvarlig": "Medisinsk fagansvarlig",
  "yrkestittel": "Yrkestittel og land",
  "tillatelse": "Offentlige tillatelser",
  "tilsynsmyndighet": "Tilsynsmyndighet",
  "org_nr_etikett": "Org.nr",
  "hpr_etikett": "HPR",
  "bestilling_apner": "Digital timebestilling er ikke klar ennå. Ring oss, så hjelper vi deg med en time.",
  "apner_nytt_vindu": "(åpner i nytt vindu)",
  "venter_pa_klinikken": "Venter på opplysning fra klinikken:",
  "venter_priser": "priser og hva som er inkludert"
}
